{
  "schema_version": "1.0.0-draft.1",
  "pack": {
    "id": "pack10-public-fixture",
    "title": "Pack 1.0 Public Synthetic Fixture",
    "version": "1.0.0-fixture.1",
    "generator": {
      "name": "Mapsoo Worldsmith",
      "version": "1.0.0-fixture.1"
    },
    "created_at": "2026-07-26T00:00:00.000Z"
  },
  "profile": "layered-depth-2d",
  "distribution": "public",
  "review": {
    "human_art": "pass",
    "rights": "pass",
    "runtime": "pass",
    "raspberry_pi": "pass"
  },
  "compatibility": {
    "godot_min": "4.3",
    "projection": "layered-depth-stage",
    "art_style": "pixel_art",
    "importer": {
      "id": "mapsoo_importer",
      "min_version": "1.0.0-fixture.1"
    }
  },
  "planes": [
    {
      "id": "sky",
      "role": "background.sky",
      "path": "layers/background-sky.png",
      "layer": "sky",
      "blend": "mix"
    },
    {
      "id": "far",
      "role": "background.far",
      "path": "layers/background-far.png",
      "layer": "far",
      "blend": "mix"
    },
    {
      "id": "mid",
      "role": "background.mid",
      "path": "layers/background-mid.png",
      "layer": "mid",
      "blend": "mix"
    },
    {
      "id": "depth-fog",
      "role": "background.depth-fog",
      "path": "layers/background-depth-fog.png",
      "layer": "depth-fog",
      "blend": "mix"
    },
    {
      "id": "near",
      "role": "near.overlay",
      "path": "layers/near-overlay.png",
      "layer": "near",
      "blend": "mix"
    },
    {
      "id": "ambient-light",
      "role": "lighting.ambient",
      "path": "layers/lighting-ambient.png",
      "layer": "ambient-light",
      "blend": "multiply"
    },
    {
      "id": "local-light",
      "role": "lighting.local",
      "path": "layers/lighting-local.png",
      "layer": "local-light",
      "blend": "add"
    },
    {
      "id": "foreground",
      "role": "foreground.overlay",
      "path": "layers/foreground-overlay.png",
      "layer": "foreground",
      "blend": "mix"
    }
  ],
  "atlases": [
    {
      "id": "terrain",
      "path": "atlases/terrain.png",
      "cell_size": [
        32,
        32
      ]
    },
    {
      "id": "props",
      "path": "atlases/props.png",
      "cell_size": [
        32,
        32
      ]
    },
    {
      "id": "structures",
      "path": "atlases/structures.png",
      "cell_size": [
        32,
        32
      ]
    },
    {
      "id": "collectibles",
      "path": "atlases/collectibles.png",
      "cell_size": [
        32,
        32
      ]
    },
    {
      "id": "effects",
      "path": "atlases/effects.png",
      "cell_size": [
        32,
        32
      ]
    },
    {
      "id": "player",
      "path": "atlases/player.png",
      "cell_size": [
        48,
        72
      ]
    },
    {
      "id": "npc",
      "path": "atlases/npc.png",
      "cell_size": [
        48,
        72
      ]
    }
  ],
  "roles": [
    {
      "role": "background.sky",
      "binding": {
        "kind": "file",
        "path": "layers/background-sky.png"
      }
    },
    {
      "role": "background.far",
      "binding": {
        "kind": "file",
        "path": "layers/background-far.png"
      }
    },
    {
      "role": "background.mid",
      "binding": {
        "kind": "file",
        "path": "layers/background-mid.png"
      }
    },
    {
      "role": "background.depth-fog",
      "binding": {
        "kind": "file",
        "path": "layers/background-depth-fog.png"
      }
    },
    {
      "role": "near.overlay",
      "binding": {
        "kind": "file",
        "path": "layers/near-overlay.png"
      }
    },
    {
      "role": "lighting.ambient",
      "binding": {
        "kind": "file",
        "path": "layers/lighting-ambient.png"
      }
    },
    {
      "role": "lighting.local",
      "binding": {
        "kind": "file",
        "path": "layers/lighting-local.png"
      }
    },
    {
      "role": "foreground.overlay",
      "binding": {
        "kind": "file",
        "path": "layers/foreground-overlay.png"
      }
    },
    {
      "role": "terrain.ground",
      "binding": {
        "kind": "atlas-region",
        "atlas": "terrain",
        "region": {
          "x": 0,
          "y": 0,
          "width": 32,
          "height": 32
        }
      }
    },
    {
      "role": "terrain.path",
      "binding": {
        "kind": "atlas-region",
        "atlas": "terrain",
        "region": {
          "x": 32,
          "y": 0,
          "width": 32,
          "height": 32
        }
      }
    },
    {
      "role": "terrain.edge",
      "binding": {
        "kind": "atlas-region",
        "atlas": "terrain",
        "region": {
          "x": 64,
          "y": 0,
          "width": 32,
          "height": 32
        }
      }
    },
    {
      "role": "terrain.bridge",
      "binding": {
        "kind": "atlas-region",
        "atlas": "terrain",
        "region": {
          "x": 96,
          "y": 0,
          "width": 32,
          "height": 32
        }
      }
    },
    {
      "role": "terrain.stairs",
      "binding": {
        "kind": "atlas-region",
        "atlas": "terrain",
        "region": {
          "x": 128,
          "y": 0,
          "width": 32,
          "height": 32
        }
      }
    },
    {
      "role": "terrain.water",
      "binding": {
        "kind": "atlas-region",
        "atlas": "terrain",
        "region": {
          "x": 160,
          "y": 0,
          "width": 32,
          "height": 32
        }
      }
    },
    {
      "role": "prop.tree",
      "binding": {
        "kind": "atlas-region",
        "atlas": "props",
        "region": {
          "x": 0,
          "y": 0,
          "width": 32,
          "height": 32
        }
      }
    },
    {
      "role": "prop.rock",
      "binding": {
        "kind": "atlas-region",
        "atlas": "props",
        "region": {
          "x": 32,
          "y": 0,
          "width": 32,
          "height": 32
        }
      }
    },
    {
      "role": "prop.crate",
      "binding": {
        "kind": "atlas-region",
        "atlas": "props",
        "region": {
          "x": 64,
          "y": 0,
          "width": 32,
          "height": 32
        }
      }
    },
    {
      "role": "prop.sign",
      "binding": {
        "kind": "atlas-region",
        "atlas": "props",
        "region": {
          "x": 96,
          "y": 0,
          "width": 32,
          "height": 32
        }
      }
    },
    {
      "role": "prop.lamp",
      "binding": {
        "kind": "atlas-region",
        "atlas": "props",
        "region": {
          "x": 128,
          "y": 0,
          "width": 32,
          "height": 32
        }
      }
    },
    {
      "role": "prop.occluder",
      "binding": {
        "kind": "atlas-region",
        "atlas": "props",
        "region": {
          "x": 160,
          "y": 0,
          "width": 32,
          "height": 32
        }
      }
    },
    {
      "role": "structure.entrance",
      "binding": {
        "kind": "atlas-region",
        "atlas": "structures",
        "region": {
          "x": 0,
          "y": 0,
          "width": 32,
          "height": 32
        }
      }
    },
    {
      "role": "structure.exit",
      "binding": {
        "kind": "atlas-region",
        "atlas": "structures",
        "region": {
          "x": 32,
          "y": 0,
          "width": 32,
          "height": 32
        }
      }
    },
    {
      "role": "structure.checkpoint",
      "binding": {
        "kind": "atlas-region",
        "atlas": "structures",
        "region": {
          "x": 64,
          "y": 0,
          "width": 32,
          "height": 32
        }
      }
    },
    {
      "role": "structure.landmark",
      "binding": {
        "kind": "atlas-region",
        "atlas": "structures",
        "region": {
          "x": 96,
          "y": 0,
          "width": 32,
          "height": 32
        }
      }
    },
    {
      "role": "collectible.primary",
      "binding": {
        "kind": "atlas-region",
        "atlas": "collectibles",
        "region": {
          "x": 0,
          "y": 0,
          "width": 32,
          "height": 32
        }
      }
    },
    {
      "role": "collectible.health",
      "binding": {
        "kind": "atlas-region",
        "atlas": "collectibles",
        "region": {
          "x": 32,
          "y": 0,
          "width": 32,
          "height": 32
        }
      }
    },
    {
      "role": "effect.footstep",
      "binding": {
        "kind": "atlas-region",
        "atlas": "effects",
        "region": {
          "x": 0,
          "y": 0,
          "width": 32,
          "height": 32
        }
      }
    },
    {
      "role": "effect.interact",
      "binding": {
        "kind": "atlas-region",
        "atlas": "effects",
        "region": {
          "x": 32,
          "y": 0,
          "width": 32,
          "height": 32
        }
      }
    },
    {
      "role": "effect.portal",
      "binding": {
        "kind": "atlas-region",
        "atlas": "effects",
        "region": {
          "x": 64,
          "y": 0,
          "width": 32,
          "height": 32
        }
      }
    },
    {
      "role": "effect.ambient",
      "binding": {
        "kind": "atlas-region",
        "atlas": "effects",
        "region": {
          "x": 96,
          "y": 0,
          "width": 32,
          "height": 32
        }
      }
    },
    {
      "role": "character.player.atlas",
      "binding": {
        "kind": "file",
        "path": "atlases/player.png"
      }
    },
    {
      "role": "character.npc.atlas",
      "binding": {
        "kind": "file",
        "path": "atlases/npc.png"
      }
    },
    {
      "role": "world.scene",
      "binding": {
        "kind": "file",
        "path": "runtime/scene.json"
      }
    },
    {
      "role": "world.collision",
      "binding": {
        "kind": "file",
        "path": "runtime/collision.json"
      }